Nome,Descritivo,Serviços,Fundadores,Informações Legais,Endereço,Site,Telefone,Email
Lexio,Otimizamos fluxos contratuais para que advogados foquem no estratégico e a Lexio cuide do operacional,Automatização de contratos | Organização de documentos | Assinatura eletronicamente | ,Fabrício Ramos | ,Investimento do Escritório Baptista Luz (anjo),"Rua Ramos Batista, 444, 7 andar",https://www.lexio.legal/,11 999941571,fabricio.ramos@lexio.legal
YALLA,CIÊNCIA DE DADOS E TECNOLOGIA NO INVESTIMENTO DE ATIVOS JUDICIAIS,Antecipação de honorários/recebíveis | Aquisição de direitos creditórios | Estruturação de ativos judiciais | ,Khalil Kaddissi | ,,"Av. Nove de Julho, 3229 - Conj. 303 - Jardim Paulista - CEP 01407-000",https://yalla.tec.br/,(11) 4395-9900,contato@yalla.tec.br
ClickJur,Cuida dos correspondentes para você.,"Clickjur, sistema de gestão de serviços para escritórios jurídicos, seus processos em dia. | ",Adriano da Silva Campos | ,,"Rua Ulisses Cruz, 579, CJ 54 B2,  CEP 03077-000",https://clickjur.com/,(11) 2626 -1015,contato@clickjur.com
Opice Blum Academy,"Seja disruptivo, antecipe tendências. Seja Opice Blum Academy!",OPICE BLUM ACADEMYIN COMPANY | ,José Roberto Opice Blum | ,,"Al. Joaquim Eugênio de Lima, 680 12º andar Jardim Paulista CEP 01418-100",https://opiceblumacademy.com.br/,11 2189 0052,contato@opiceblumacademy.com.br
Expedit Lawtech,"Acompanhe seus processos em todo o Brasil, de forma rápida e prática, com qualidade e excelência.",Expedit Distribuições | Expedit Publicações DJ | Expedit Andamentos | Expedit Intimações | ,,,,,,
MT4,A nova era em propriedade intelectual,Marcas | Patentes | Desenhos Industriais | Softwares | Direitos autorais | Contratos | Litígios | Concorrência desleal | LGPD | Nomes de domínio | Gestão de inovação | Direito Empresarial | ,MAURÍCIO TAVARES | ,,"Av. Paulista 2421, 1º Andar Bela Vista, São Paulo/SP CEP 01311-300",https://www.mt4ip.com.br/,-,info@mt4ip.com.br
VERIFACT,A solução online mais confiável para o registro de provas digitais de conteúdos da internet.,Plataforma online de coleta de provas digitais | ,Regina Acutu | ,"A Verifact já foi acelerada e recebeu investimento da Wow Aceleradora em 2020. Atualmente está em fase de tração, com crescimento exponencial de clientes e faturamento.","Avenida Bento Munhoz da Rocha Netto, 632. Slj 02 sl 201/204 T. Norte. Zona 07, Maringá, Paraná. CEP 87030-010",https://www.verifact.com.br/,11 957841206,faleconosco@verifact.com.br
PEJOTA CONTABILIDADE,Contabilidade para Advogados,,,,"Av. Raja Gabaglia, 4343, 3º andar Bairro: Santa Lúcia | CEP: 30350-577",https://pejota.com.br,+55 (31) 3378-0701,financeiro@pejota.com.br
